<?xml version="1.0" encoding="UTF-8"?>
<document filename="eu-033.pdf"
    xmlns:xsi="http://www.w3.org/2001/XMLSchema-instance" xsi:noNamespaceSchemaLocation="competition-entry-region-model.xsd">
    <table id="0">
        <region id="0" page="1">
            <instruction instr-id="329"/>
            <instruction instr-id="333"/>
            <instruction instr-id="336"/>
            <instruction instr-id="339"/>
            <instruction instr-id="342"/>
            <instruction instr-id="345"/>
            <instruction instr-id="348"/>
            <instruction instr-id="352" subinstr-id="0"/>
            <instruction instr-id="352" subinstr-id="2"/>
            <instruction instr-id="356"/>
            <instruction instr-id="360" subinstr-id="0"/>
            <instruction instr-id="360" subinstr-id="2"/>
            <instruction instr-id="360" subinstr-id="4"/>
            <instruction instr-id="363"/>
            <instruction instr-id="366" subinstr-id="0"/>
            <instruction instr-id="366" subinstr-id="2"/>
            <instruction instr-id="366" subinstr-id="4"/>
            <instruction instr-id="370"/>
            <instruction instr-id="372"/>
            <instruction instr-id="375"/>
            <instruction instr-id="378"/>
            <instruction instr-id="381"/>
            <instruction instr-id="412" subinstr-id="0"/>
            <instruction instr-id="412" subinstr-id="2"/>
            <instruction instr-id="412" subinstr-id="4"/>
            <instruction instr-id="412" subinstr-id="6"/>
            <instruction instr-id="412" subinstr-id="8"/>
            <instruction instr-id="412" subinstr-id="10"/>
            <instruction instr-id="412" subinstr-id="12"/>
            <instruction instr-id="439" subinstr-id="0"/>
            <instruction instr-id="439" subinstr-id="2"/>
            <instruction instr-id="439" subinstr-id="4"/>
            <instruction instr-id="439" subinstr-id="6"/>
            <instruction instr-id="439" subinstr-id="8"/>
            <instruction instr-id="439" subinstr-id="10"/>
            <instruction instr-id="464" subinstr-id="0"/>
            <instruction instr-id="464" subinstr-id="2"/>
            <instruction instr-id="464" subinstr-id="4"/>
            <instruction instr-id="464" subinstr-id="6"/>
            <instruction instr-id="464" subinstr-id="8"/>
            <instruction instr-id="464" subinstr-id="10"/>
            <instruction instr-id="489" subinstr-id="0"/>
            <instruction instr-id="489" subinstr-id="2"/>
            <instruction instr-id="489" subinstr-id="4"/>
            <instruction instr-id="489" subinstr-id="6"/>
            <instruction instr-id="489" subinstr-id="8"/>
            <instruction instr-id="489" subinstr-id="10"/>
            <instruction instr-id="514" subinstr-id="0"/>
            <instruction instr-id="514" subinstr-id="2"/>
            <instruction instr-id="514" subinstr-id="4"/>
            <instruction instr-id="514" subinstr-id="6"/>
            <instruction instr-id="514" subinstr-id="8"/>
            <instruction instr-id="514" subinstr-id="10"/>
            <instruction instr-id="539" subinstr-id="0"/>
            <instruction instr-id="539" subinstr-id="2"/>
            <instruction instr-id="539" subinstr-id="4"/>
            <instruction instr-id="539" subinstr-id="6"/>
            <instruction instr-id="539" subinstr-id="8"/>
            <instruction instr-id="539" subinstr-id="10"/>
            <instruction instr-id="569"/>
            <instruction instr-id="572" subinstr-id="2"/>
            <instruction instr-id="572" subinstr-id="4"/>
            <instruction instr-id="572" subinstr-id="6"/>
            <instruction instr-id="572" subinstr-id="8"/>
            <instruction instr-id="572" subinstr-id="10"/>
            <bounding-box x1="79" x2="519" y1="167" y2="391"/>
        </region>
    </table>
</document>
